{
  "schemaVersion": "obserra.legal-identity-audit.v2",
  "schemaPath": "docs/compliance/LEGAL-IDENTITY-AUDIT.schema.json",
  "legalEntityName": "OBSERRA EXECUTIVE PROTECTION & INTELLIGENCE LLC",
  "canonicalPublicOrigin": "https://www.obserrallc.com",
  "sourceRevision": {
    "kind": "working_tree_content_digest",
    "sourceTreeSha256": "3e97b7aac8ed2570227d65ca4a5de2737aa73e0bcb65fa2665fb115fa55359b9",
    "checkedFileCount": 362
  },
  "scope": {
    "includedRoots": [
      "app",
      "lib",
      "scripts",
      "supabase/migrations",
      ".github/workflows"
    ],
    "includedExactPaths": [
      "package.json",
      "tsconfig.json",
      "next.config.ts",
      "proxy.ts",
      "docs/compliance/LEGAL-IDENTITY-AUDIT.schema.json",
      "docs/compliance/CMMC-SYSTEM-SCOPE-SOURCE.json",
      "docs/florida-class-d-lms/FDACS-PII-DATABASE-AUDIT-SOURCE.json"
    ],
    "excludedWorkstream": "Applications product workstream",
    "excludedPathPrefixes": [
      "app/apps/",
      "app/api/apps/",
      "app/portal/applications/",
      "lib/apps/",
      "release/application-production/",
      ".github/workflows/application-",
      "scripts/application-"
    ],
    "excludedExactPaths": [
      "docs/compliance/LEGAL-IDENTITY-AUDIT.json",
      "docs/compliance/LEGAL-IDENTITY-AUDIT.md",
      "docs/compliance/LEGAL-IDENTITY-AUDIT.sha256",
      "scripts/generate-app-release-bundle.mjs",
      "scripts/sync-final-apps.mjs",
      "scripts/validate-application-staging.mjs",
      "scripts/watch-final-apps.ps1"
    ]
  },
  "permittedProductBrands": [
    "Obserra Academy",
    "Obserra EIOS",
    "Obserra Certificate of Training",
    "Obserra Certificates of Training",
    "Obserra Cloud",
    "Obserrian"
  ],
  "identifierBoundary": {
    "stableTechnicalIdentifiersMayRetainObserraToken": true,
    "examples": [
      "environment variables",
      "HTTP headers",
      "schema identifiers",
      "database enum values",
      "asset paths",
      "CSS classes",
      "download filenames"
    ],
    "rule": "A technical identifier is not a legal-entity claim. Human-visible owner, provider, merchant, employer, issuer, school, policy, service, and company wording must use the exact legal name unless it is one of the enumerated product brands."
  },
  "cmmcEvidenceMapping": {
    "systems": [
      "SYS-ORG-GOVERNANCE",
      "SYS-WEBSITE",
      "SYS-ACADEMY-LMS",
      "SYS-STRIPE-PAYMENTS",
      "SYS-FDACS-DATABASE"
    ],
    "governingAuthorities": [
      "32 CFR Part 170",
      "CMMC Level 2 Assessment Guide v2.13 (September 2024)",
      "NIST SP 800-171 Revision 2",
      "NIST SP 800-171A (June 2018)"
    ],
    "supplementalAuthorities": [
      "NIST SP 800-171 Revision 3",
      "NIST SP 800-171A Revision 3"
    ],
    "governingRev2Controls": [
      "3.3.1",
      "3.4.1",
      "3.4.2",
      "3.4.3",
      "3.4.4",
      "3.4.5"
    ],
    "supplementalRev3Controls": [
      "03.03.01",
      "03.04.01",
      "03.04.02",
      "03.04.03",
      "03.04.04",
      "03.04.05"
    ],
    "claimBoundary": "This source audit supports configuration identification, controlled change, and evidence integrity. It is not an assessor determination and does not establish CMMC certification."
  },
  "candidateValidation": {
    "method": "source_scan",
    "gatePath": "scripts/legal-identity-audit.mjs",
    "outcome": "satisfied_locally_non_authoritative",
    "findingCount": 0
  },
  "authoritativeTechnicalResult": {
    "state": "not_tested",
    "authority": "final_approved_production_release",
    "failClosed": true,
    "reason": "The inspected source is an unpublished working-tree candidate. No exact approved commit, READY production deployment, canonical production verification result, or hashed final result artifact is bound to this record."
  },
  "releaseFinalization": {
    "exactReleaseCommitSha": null,
    "approvalState": "pending",
    "publicationState": "not_published",
    "productionDeploymentId": null,
    "canonicalProductionVerificationState": "not_executed",
    "finalResultArtifactSha256": null
  },
  "humanReview": {
    "state": "pending",
    "pendingIsTechnicalFailure": false
  },
  "assessorDetermination": "not_assessed",
  "eligibleAsFinalEvidence": false,
  "claimBoundary": "The audit proves only that the inspected working-tree candidate satisfied the legal-name source policy. Its authoritative technical state remains not_tested. Live rendering, external provider configuration, an exact approved release, canonical production verification, and a hashed final result artifact must be bound before this artifact can become green or final evidence."
}
